,term_1_umls_name,term_2_umls_name,sentence,term_1_umls_synonyms,term_2_umls_synonyms,pipeline,relation,evidence_count,Treat/Cause_str,is_correct,
196,tg - triglyceride,adult onset diabetes,"The increased risk of coronary heart disease associated with type 2 diabetes may be partially explained by dyslipidemia characterized by high plasma triacylglycerol (TAG), low HDL cholesterol, and a predominance of atherogenic small dense LDLs.___Background The accumulation of myocardial triglycerides and remodeling of the left ventricle are common features in type 2 diabetes mellitus and represent potential risk factors for the development of diastolic and systolic dysfunction.",tg - triglyceride;triacylglycerol;triacylglycerol (substance);triacylglycerols;triglyceride;triglycerides,"adult onset diabetes;adult onset diabetes mellitus;adult-onset diabetes;adult-onset diabetes mellitus;adult-onset; diabetes;aodm;diabete type 2;diabetes mellitus (adult onset);diabetes mellitus (niddm);diabetes mellitus - adult ons;diabetes mellitus - adult onset;diabetes mellitus -adult onset;diabetes mellitus maturity onset;diabetes mellitus non insulin dependent;diabetes mellitus non insulin-dep;diabetes mellitus non-insulin-dependent;diabetes mellitus nos late onset;diabetes mellitus type 02;diabetes mellitus type 2;diabetes mellitus type 2 (disorder);diabetes mellitus type ii;diabetes mellitus, adult onset;diabetes mellitus, adult onset type;diabetes mellitus, adult-onset;diabetes mellitus, ketosis resistant;diabetes mellitus, ketosis-resistant;diabetes mellitus, maturity onset;diabetes mellitus, maturity-onset;diabetes mellitus, non insulin dependent;diabetes mellitus, non-insulin dependent;diabetes mellitus, non-insulin-dependent;diabetes mellitus, noninsulin dependent;diabetes mellitus, noninsulin-dependent;diabetes mellitus, slow onset;diabetes mellitus, slow-onset;diabetes mellitus, stable;diabetes mellitus, type 2;diabetes mellitus, type ii;diabetes mellitus: [adult onset] or [noninsulin dependent];diabetes mellitus: [adult onset] or [noninsulin dependent] (disorder);diabetes non-insulin dependent;diabetes type 2;diabetes type ii;diabetes, adult onset;diabetes, ketosis resistant;diabetes, maturity onset;diabetes, maturity-onset;diabetes, type 2;diabetes, type ii;diabetes; adult-onset;diabetes; maturity-onset;diabetes; niddm;diabetes; non-insulin-dependent;diabetes; nonketotic;diabetes; type ii;diabetes;adult onset;diabetes;non insulin depend;diabetes;type 2;ketosis resistant diabetes;ketosis-resistant diabetes mellitus;late onset diabetes;maturity onset diabetes;maturity onset diabetes mellit;maturity onset diabetes mellitus;maturity-onset diabetes;maturity-onset diabetes mellitus;maturity-onset; diabetes;mod;ncdmm;niddm;niddm - non-insulin dependent diabetes mellitus;niddm diabetes mellitus;niddm-non-ins dep diabetes mel;niddm; diabetes;non insulin dependent diabetes;non-ins-dep diabetes mellitus;non-insulin dependent diabetes;non-insulin dependent diabetes mellitus;non-insulin-dependent diabetes;non-insulin-dependent diabetes mellitus;non-insulin-dependent; diabetes;noninsulin dependent diab.mell;noninsulin dependent diabetes;noninsulin dependent diabetes mellitus;noninsulin-dependent diabetes;noninsulin-dependent diabetes mellitus;nonketotic; diabetes;slow-onset diabetes mellitus;stable diabetes mellitus;t2dm - type 2 diabetes mellitus;type 2 diabetes;type 2 diabetes mellitus;type 2 diabetes mellitus (diagnosis);type 2 diabetes mellitus non-insulin dependent;type ii diabetes;type ii diabetes mellitus;type ii diabetes mellitus (disorder);type ii; diabetes",chemdis,cause,2,cause,1,
197,tg - triglyceride,body fails to respond to insulin,"Insulin resistance syndrome is the theory that glucose intolerance, hyperinsulinemia, increased very low density lipoprotein triglyceride level, decreased high density lipoprotein cholesterol level, and hypertension are proposed consequences of insulin resistance.",tg - triglyceride;triacylglycerol;triacylglycerol (substance);triacylglycerols;triglyceride;triglycerides,"body fails to respond to insulin;drug resistance to insulin;drug resistance to insulin (disorder);insulin resistance;insulin resistance (diagnosis);insulin resistance (disorder);resistance, insulin",chemdis,cause,1,cause,,
198,tg - triglyceride,cardiomyopathy,Cardiomyopathy in diabetic MHC-PPAR mice was accompanied by myocardial long-chain triglyceride accumulation.,tg - triglyceride;triacylglycerol;triacylglycerol (substance);triacylglycerols;triglyceride;triglycerides,cardiomyopathy,chemdis,cause,1,cause,,
199,tg - triglyceride,"cardiovascular syndrome, metabolic","The metabolic syndrome (MetS) is manifested by a lipid triad which includes elevated serum triglycerides, small LDL particles, and low high-density lipoprotein (HDL) cholesterol, by central obesity (central adiposity), insulin resistance, glucose intolerance and elevated blood pressure, and it is associated with an increased risk of type 2 diabetes and coronary heart disease.",tg - triglyceride;triacylglycerol;triacylglycerol (substance);triacylglycerols;triglyceride;triglycerides,"cardiovascular syndrome, metabolic;cardiovascular syndromes, metabolic;dysmetabolic syndrome x;dysmetabolic syndrome x (diagnosis);equine metabolic syndrome;insulin resistance syndrome x;metabolic cardiovascular syndrome;metabolic syndrome;metabolic syndrome x;metabolic syndrome x (disorder);metabolic syndromes;metabolic x syndrome;reaven syndrome x;reaven's syndrome;syndrome metabolic;syndrome x (metabolic);syndrome x insulin resistance;syndrome x, dysmetabolic;syndrome x, insulin resistance;syndrome x, metabolic;syndrome x, reaven;syndrome, metabolic;syndrome, metabolic cardiovascular;syndrome, metabolic x;syndromes, metabolic;x syndrome, metabolic",chemdis,cause,1,cause,,
200,tg - triglyceride,coronary heart disease,"Patients with highly increased plasma triglyceride levels are at risk of developing serious complications such as pancreatitis, coronary heart disease and stroke.",tg - triglyceride;triacylglycerol;triacylglycerol (substance);triacylglycerols;triglyceride;triglycerides,coronary heart disease,chemdis,cause,1,cause,1,
201,tg - triglyceride,diabetic,Cardiomyopathy in diabetic MHC-PPAR mice was accompanied by myocardial long-chain triglyceride accumulation.,tg - triglyceride;triacylglycerol;triacylglycerol (substance);triacylglycerols;triglyceride;triglycerides,diabetic;diabetics,chemdis,cause,1,cause,,
202,tg - triglyceride,diabetic dyslipidaemia,"The diabetic dyslipidemia in these patients is characterized by moderately high levels of (1) serum cholesterol and triglycerides; (2) small, dense low-density lipoprotein (LDL) particles; and (3) low high-density lipoprotein (HDL) cho-lesterol concentrations.",tg - triglyceride;triacylglycerol;triacylglycerol (substance);triacylglycerols;triglyceride;triglycerides,diabetic dyslipidaemia;diabetic dyslipidemia,chemdis,cause,1,cause,,
203,tg - triglyceride,dis metab,"Obesity is a metabolic disorder that can lead to adverse metabolic effects on blood pressure, cholesterol, triglycerides and insulin resistance and also increases the risk of coronary heart disease, ischemic stroke and type 2 diabetes mellitus.",tg - triglyceride;triacylglycerol;triacylglycerol (substance);triacylglycerols;triglyceride;triglycerides,"dis metab;disease, metabolic;disease;metabolic;diseases, metabolic;disorder of metabolism nos;disorder of metabolism nos (disorder);disorder; metabolism;disorder;metabolic;general; metabolic disorder;generalised metabolic disorder;generalized metabolic disorder;generalized metabolic disorder (disorder);md - metabolic disorders;metab dis;metabolic derangement;metabolic disease;metabolic disease (disorder);metabolic disease, nos;metabolic diseases;metabolic disorder;metabolic disorder nos;metabolic disorder, nos;metabolic disorder, unspecified;metabolic disorder; general;metabolic disorders;metabolic disorders (diagnosis);metabolic disorders (disorder);metabolic disorders: general;metabolism disorder;metabolism disorder nos;metabolism disorders;metabolism--disorders;metabolism; disorder;metabolism; disorder, general;rndx metabolic;rndx metabolic (diagnosis);thesaurismoses;thesaurismosis;unspecified disorder of metabolism",chemdis,cause,1,cause,0,
204,tg - triglyceride,heart failure,"Triglyceride deposit cardiomyovasculopathy (TGCV), a rare cardiovascular disorder caused by genetic or acquired dysfunction of adipose triglyceride lipase (ATGL), is marked by defective intracellular lipolysis that results in excessive accumulation of triglycerides (TGs) in the myocardium and coronary arteries, leading to intractable heart failure (HF).",tg - triglyceride;triacylglycerol;triacylglycerol (substance);triacylglycerols;triglyceride;triglycerides,heart failure,chemdis,cause,1,cause,,
205,tg - triglyceride,hepatic injury,"Female offspring exposed to a postweaning obesogenic diet (OffCon-OD) demonstrated evidence of liver injury, which was exacerbated by previous exposure to maternal obesity (OffOb-OD), as demonstrated by raised alanine aminotransferase, hepatic triglycerides, and hepatic expression of interleukin (IL)-6, tumor necrosis factor alpha, transforming growth factor beta, alpha smooth muscle actin, and collagen (P < 0.01).",tg - triglyceride;triacylglycerol;triacylglycerol (substance);triacylglycerols;triglyceride;triglycerides,"hepatic injury;hepatic injury, nos;hepatic trauma;injuries liver;injury hepatic;injury liver;injury of liver;injury of liver (diagnosis);injury of liver (disorder);injury of liver, nos;injury of liver, unspecified;injury to liver;injury to liver, nos;injury to liver, nos (disorder);injury; liver;liver injury;liver; injury;of liver injury;unspecified injury of liver",chemdis,cause,1,cause,,
206,tg - triglyceride,pancreatitis,"Patients with highly increased plasma triglyceride levels are at risk of developing serious complications such as pancreatitis, coronary heart disease and stroke.",tg - triglyceride;triacylglycerol;triacylglycerol (substance);triacylglycerols;triglyceride;triglycerides,pancreatitis,chemdis,cause,1,cause,,
207,tg - triglyceride,stroke,"Patients with highly increased plasma triglyceride levels are at risk of developing serious complications such as pancreatitis, coronary heart disease and stroke.",tg - triglyceride;triacylglycerol;triacylglycerol (substance);triacylglycerols;triglyceride;triglycerides,stroke,chemdis,cause,1,cause,,
208,vitamin a,deficiencies micronutrient,"Specific micronutrient deficiencies can also lead to neurodisability, for example, blindness (vitamin A), intractable epilepsy (vitamin B6), and cognitive impairment (iodine and iron).",vitamin a,deficiencies micronutrient;deficiency of micronutrients;deficiency of micronutrients (disorder);micronutrient deficiencies;micronutrients deficiency,chemdis,cause,1,cause,0,
209,vitamin a,gastroduodenal ulcer,This suggests that increased consumption of vitamin A may prove to reduce mortality rates due to heart disease and peptic ulcer.,vitamin a,"gastroduodenal ulcer;gastroduodenal ulcer nos;gastroduodenal ulcer, nos;gastroduodenal ulcers;gdu;peptic ulcer;peptic ulcer (diagnosis);peptic ulcer (disorder);peptic ulcer (ulcer);peptic ulcer - (pu) site unsp.;peptic ulcer - (pu) site unspecified;peptic ulcer - (pu) site unspecified (disorder);peptic ulcer disease;peptic ulcer disorder;peptic ulcer nos (disorder);peptic ulcer nos = pu;peptic ulcer syndrome;peptic ulcer, nos;peptic ulcer, site unspecified;peptic ulcer; site unspecified;peptic ulceration;peptic ulcers;peptic; ulcer;pu - peptic ulcer;pud;pud - peptic ulcer disease;sore in the lining of gastrointestinal tract;syndrome peptic ulcer;ulcer disease;ulcer gastroduodenal;ulcer of the gastrointestinal tract;ulcer peptic;ulcer syndrome peptic;ulcer, gastroduodenal;ulcer, peptic;ulcer; peptic;ulcer;peptic;ulcers, gastroduodenal;ulcers, peptic;unspecified peptic ulcer;unspecified peptic ulcer (disorder);unspecified peptic ulcer nos;unspecified peptic ulcer nos (disorder)",chemdis,cause,1,cause,0,
210,vitamin a,neurodisability,"Specific micronutrient deficiencies can also lead to neurodisability, for example, blindness (vitamin A), intractable epilepsy (vitamin B6), and cognitive impairment (iodine and iron).",vitamin a,neurodisability;neurodisability (finding),chemdis,cause,1,cause,0,
211,vitamin b6,deficiencies micronutrient,"Specific micronutrient deficiencies can also lead to neurodisability, for example, blindness (vitamin A), intractable epilepsy (vitamin B6), and cognitive impairment (iodine and iron).",vitamin b6,deficiencies micronutrient;deficiency of micronutrients;deficiency of micronutrients (disorder);micronutrient deficiencies;micronutrients deficiency,chemdis,cause,1,cause,0,
212,vitamin b6,neurodisability,"Specific micronutrient deficiencies can also lead to neurodisability, for example, blindness (vitamin A), intractable epilepsy (vitamin B6), and cognitive impairment (iodine and iron).",vitamin b6,neurodisability;neurodisability (finding),chemdis,cause,1,cause,0,
213,vitamin b6,stroke,"Increased intake of vitamin B6, B12, and folate has been associated with reduction of homocysteine levels; elevated homocysteine blood levels have been associated with the occurrence of stroke, heart attack, and cardiovascular death.",vitamin b6,stroke,chemdis,cause,1,cause,,
214,vitamin c,bone pain,"As this disease can lead to severe complications, such as bone pain, heart failure or gastrointestinal symptoms, nothing should delay vitamin C supplementation, which is a simple and rapidly effective treatment.",vitamin c,bone pain,chemdis,cause,1,cause,1,
218,vitamin d,"[x]mal neoplasm/skin,unspecfd","Although some have suggested increased sun exposure to increase serum vitamin D levels, this has the potential to induce photoaging and skin cancer, especially in patients at risk for these conditions.",vitamin d,"[x]mal neoplasm/skin,unspecfd;[x]malignant neoplasm of skin, unspecified;[x]malignant neoplasm of skin, unspecified (disorder);ca - skin cancer;cancer of skin;cancer of the skin;cancer skin;cancer, skin;cancers skin;cancers, skin;mal neoplasm/skin,unspecfd;malignant neoplasm of skin;malignant neoplasm of skin (diagnosis);malignant neoplasm of skin (disorder);malignant neoplasm of skin nos;malignant neoplasm of skin nos (disorder);malignant neoplasm of skin, nos;malignant neoplasm of skin, unspecified;malignant neoplasm of the skin;malignant neoplasm skin;malignant neoplasm skin nos;malignant neoplasms of skin;malignant neosplasm of the skin;malignant skin neoplasm;malignant skin neoplasm nos;malignant skin tumor;malignant tumor of skin;malignant tumor of the skin;malignant tumour of skin;malignant tumour of skin (disorder);melanoma and non-melanoma skin cancer;neoplasm malig;skin;of skin cancer;of the skin cancer;skin cancer;skin cancer (diagnosis);skin cancer, including melanoma;skin cancer, nonmelanomatous (squamous and basal cell);skin cancer, nos;skin cancers;skin malignant neoplasm nos;skin neoplasm malignant;skin neoplasm malignant nos;skin neoplasm, malignant;skin neoplasms malignant and unspecified;skin--cancer",chemdis,cause,1,cause,1,
219,vitamin d,abnormally low blood calcium levels,She was diagnosed with severe hypocalcaemia secondary to severe vitamin D deficiency.,vitamin d,abnormally low blood calcium levels;calcium deficiency disease;hypocalcaemia;hypocalcaemia syndrome;hypocalcemia (diagnosis);hypocalcemia (disorder);hypocalcemia syndrome;hypocalcemias;low blood calcium levels,chemdis,cause,1,cause,0,
220,vitamin d,autonomic dysfunction,"Moreover, patients with ESKD are often vitamin D deficient, which we have shown may be linked to autonomic dysfunction in humans.",vitamin d,autonomic dysfunction,chemdis,cause,1,cause,0,
221,vitamin d,bone demineralized,"High spread of osteopenia among patients with CVD was expected because of deficiency in calcium consumption and their lowe supply with vitamin D, that appears risk factors of osteoporosis.___Homebound and institutionalized elderly persons often do not expose their skin to sunlight; because the skin of older persons has a decreased ability to form vitamin D, the vitamin D status in these persons is precarious and they are at risk for osteopenia.",vitamin d,"bone demineralized;bone density, low;bone loss;bone; loss;loss; bone;low bone densities;low bone mineral density;osteopaenia;osteopenia;osteopenia (diagnosis);osteopenia (disorder);osteopenia (morphologic abnormality);osteopenias",chemdis,cause,2,cause,0,
222,vitamin d,"calcification, vascular","However, using vitamin D entails possible adverse risks of hypercalcemia, hyperphosphatemia, and vascular calcifications.___Both the high prevalence of vitamin D deficiency in the general population and the identification of the vitamin D receptor in the heart and blood vessels raised interest in the potential cardiovascular effects of vitamin D. Experimental studies have demonstrated various cardiovascular protective actions of vitamin D, but vitamin D intoxication in animals is known to induce vascular calcification.",vitamin d,"calcification, vascular;calcifications vascular;calcifications, vascular;calcinoses, vascular;calcinosis, vascular;vascular calcification;vascular calcification (disorder);vascular calcifications;vascular calcinoses;vascular calcinosis",chemdis,cause,2,cause,1,
223,vitamin d,"cardiomyopathies, dilated",We identified three infants with dilated cardiomyopathy (DCM) secondary to severe vitamin D deficieny and hypocalcaemia.,vitamin d,"cardiomyopathies, dilated;cardiomyopathy congestive;cardiomyopathy dilated;cardiomyopathy, dilated;cardiomyopathy; cardiomyopathy, dilated;cardiomyopathy;congestive;ccm - congestive cardiomyopath;ccm - congestive cardiomyopathy;cocm - congestive cardiomyop;cocm - congestive cardiomyopathy;cocm congestive (dilated) cardiomyopathy;congestive (dilated) cardiomyopathy;congestive cardiomyopathy (diagnosis);congestive cardiomyopathy (disorder);congestive dilated cardiomyopathy;dcm - dilated cardiomyopathy;dilated cardiomyopathies;dilated cardiomyopathy;dilated cardiomyopathy (diagnosis);heart; dilatation, cardiomyopathy;primary dilated cardiomyopathy;primary dilated cardiomyopathy (disorder);stretched and thinned heart muscle",chemdis,cause,1,cause,,
224,vitamin d,cognitive defects,"Low levels of serum 25-hydroxyvitamin D [25(OH)D], a stable marker of vitamin D status, are also associated with increased odds of prevalent cognitive dysfunction, Alzheimer's disease and all-cause dementia in a number of studies, raising the possibility that vitamin D plays a role in the aetiology of cognitive dysfunction and dementia.",vitamin d,"cognitive defects;cognitive disturbances;cognitive dysfunction;cognitive dysfunctions;cognitive function abnormal;cognitive impairment;cognitive impairments;disturbance in cognition;dysfunction, cognitive;dysfunctions, cognitive;impaired cognition;impaired cognition (finding);impairment, cognitive;impairment;cognitive;impairments, cognitive;neurocognitive disturbance;neurocognitive dysfunction",chemdis,cause,1,cause,,
227,vitamin d,hypercalcemia,"However, using vitamin D entails possible adverse risks of hypercalcemia, hyperphosphatemia, and vascular calcifications.",vitamin d,hypercalcemia,chemdis,cause,1,cause,1,
229,vitamin d,thrombosis,"Hyperinsulinaemia decreases cholesterol sulfurylation to cholesterol sulfate, as low vitamin D regulation due to magnesium depletion and/or vitamin D sequestration and/or diminished activation capacity decreases sulfotransferase enzyme SULT2B1b activity, consequently decreasing plasma membrane negative charge between red blood cells, platelets and endothelial cells, thus increasing agglutination and thrombosis.",vitamin d,thrombosis,chemdis,cause,1,cause,,
231,vitamin e,atherosclerosis,High doses of vitamin E may confer an increased risk of calcified atherosclerosis.,vitamin e,atherosclerosis,chemdis,cause,1,cause,1,
232,vitamin e,heart failure,"Yet, high doses of supplemental vitamin E have been associated with an elevated risk of heart failure and all-cause mortality.___Vitamin E supplementation might be associated with an increase in total mortality, heart failure, and hemorrhagic stroke.",vitamin e,heart failure,chemdis,cause,2,cause,1,
233,vitamin k,37 hemorrhages,"Factors that interrupted INR control in our population, arranged in descending sequence, were concurrent medication use 46.9% (mainly Salicylates and Amiodarone), smoking cigarettes and shisha 17% (represented the most frequent single factor that caused non-TINR in the present study), a nonbalanced dietary vitamin K intake 16.88% caused changes in INR (lower) was related to an increase in the intake of vitamin K-rich food, were noticed to be much more in the spring season in Jordan (end of March and April mainly), herbal supplements 15.02%; Hawthorn (Crataegus, الزعرور) is an herb that lives widely in Jordan, and shockingly we found that it is used very commonly in our ACC patients and corresponded to an elevated INR <8 in 11 patients, and serious bleeding events that required hospitalization in 2 cases), noncompliance 1.49%, comorbid diseases 1%, malabsorption 0.53%, alcohol intake 0.39%, and VKORC1 A/G and CYP2C9 *1*1 genotype 0.15%.",vitamin k,"37 hemorrhages;bleed;bleed_nos;bleed_nos problem;bleeding;bleeding (disorder);bleeding (finding);bleeding (symptom);bleeding -retired-;bleeding hemorrhage;bleeding problem;bleeding site unspecified;bleeding, nos;bleeding/haemorrhage nos;bleeding/hemorrhage nos;bleeds;blood loss of (nos);blood; extravasation;extravasation blood;extravasation of blood;extravasation; blood;haemorrhage;haemorrhage nos;haemorrhage nos (disorder);haemorrhage, nos;haemorrhage, unspecified;haemorrhages;hem;hemorrhage;hemorrhage (diagnosis);hemorrhage (morphologic abnormality);hemorrhage (nos);hemorrhage bleeding;hemorrhage nos;hemorrhage nos (disorder);hemorrhage, nos;hemorrhage, unspecified;hemorrhages",chemdis,cause,1,cause,,
234,acid fatty trans,3-10 heart diseases: general terms,In the early 1990s it was shown that trans fatty acids increase the risk of heart disease.,"acid fatty trans;acid trans fatty;acid, trans fatty;acids fatty tran;acids fatty trans;acids trans-fatty;acids, trans fatty;acids, trans-fatty;fatty acid, trans;fatty acids, trans;trans fat;trans fat (substance);trans fats;trans fatty acid;trans fatty acids;trans-fatty acids","3-10 heart diseases: general terms;cardiac dis;cardiac disease;cardiac diseases;cardiac disorder;cardiac disorder nos;cardiac disorders;cardiopathies;cardiopathy;cardiopathy, nos;cordis; morbus;disease cardiac;disease disorders heart;disease hearts;disease or syndrome of heart;disease;heart;diseases and syndromes of heart;diseases disorders heart;diseases of the heart;disorder cardiac (nos);disorder heart;disorder of heart;heart dis;heart disease;heart disease (diagnosis);heart disease (disorder);heart disease disorder;heart disease nos;heart disease nos (disorder);heart disease, nos;heart disease, unspecified;heart diseases;heart diseases: general terms;heart disorder;heart disorders;heart--diseases;morbus cordis;morbus cordis nos;morbus cordis, nos;morbus; cordis;rndx cardiac;rndx cardiac (diagnosis);section 3-1 heart diseases;syndrome heart disease;unspecified heart problem",foodis,cause,1,cause,1,
235,acid fatty trans,coronary heart disease,Current scientific evidence indicates that consumption of industrial trans fatty acids (TFA) produced via partial hydrogenation of vegetable oils increases the risk of coronary heart disease.___Some data indicate that consumption of trans fatty acids increases the risk of coronary heart disease (CHD).___High consumption of trans fat has been linked to the risk of coronary heart disease (CHD).,"acid fatty trans;acid trans fatty;acid, trans fatty;acids fatty tran;acids fatty trans;acids trans-fatty;acids, trans fatty;acids, trans-fatty;fatty acid, trans;fatty acids, trans;trans fat;trans fat (substance);trans fats;trans fatty acid;trans fatty acids;trans-fatty acids",coronary heart disease,foodis,cause,3,cause,1,
236,acid fatty trans,obesity,"Saturated and trans fatty acids have been implicated in obesity, heart disease, diabetes and cancer while polyunsaturated fatty acids (PUFAs) generally have a positive effect on health.","acid fatty trans;acid trans fatty;acid, trans fatty;acids fatty tran;acids fatty trans;acids trans-fatty;acids, trans fatty;acids, trans-fatty;fatty acid, trans;fatty acids, trans;trans fat;trans fat (substance);trans fats;trans fatty acid;trans fatty acids;trans-fatty acids",obesity,foodis,cause,1,cause,1,
