,term_1_umls_name,term_2_umls_name,sentence,term_1_umls_synonyms,term_2_umls_synonyms,pipeline,relation,evidence_count,Treat/Cause_str,is_correct,
372,a09 estrogenic preparations,3-81-82 diseases of the arteries,"In the primary prevention of arterial disease, there may be a role for anti-oxidant vitamins and for oestrogen replacement therapy in postmenopausal women.","a09 estrogenic preparations;agents, estrogenic;agonists, estrogen receptor;compounds, estrogenic;estrogen (substance);estrogen preparation;estrogen preparation, nos;estrogen product;estrogen products;estrogen receptor agonist;estrogen receptor agonist-containing product;estrogen receptor agonists;estrogen substance;estrogen, nos;estrogen-containing product;estrogenic agents;estrogenic compounds;estrogenic drug;estrogenic drug, nos;estrogenic preparation;estrogenic preparation (product);estrogenic preparation (substance);estrogenic preparations;estrogens (medication);estrogens (product);estrogens (substance);oestrogen;oestrogen preparation, nos;oestrogen product;oestrogen products;oestrogen, nos;oestrogenic drug;oestrogenic drug, nos;oestrogenic preparation;oestrogens;product containing estrogen;product containing estrogen (product);product containing estrogen receptor agonist (product);product containing oestrogen;receptor agonists, estrogen;substance with estrogen receptor agonist mechanism of action (substance);therapeutic estrogen","3-81-82 diseases of the arteries;arterial disease;arterial disease (disorder);arterial diseases;arterial disorder;arterial disorder nos;arterial disorders;arterial vascular disease;arteriopath;arteriopathic disease;arteriopathy;artery disease;artery diseases;artery disorder;artery disorders;artery; disorder;disease (or disorder); artery;disease of arteries, arterioles and capillaries;disease of artery;disease of artery (disorder);disease of artery [ambiguous];disease of artery, nos;diseases of the arteries;disorder of artery;disorder of artery (disorder);disorder of artery [ambiguous];disorder of artery, nos;generalised arterial disease;generalized arterial disease;vascular arterial disease",chemdis,treat,1,treat,,
373,acid fatty polyunsaturated,3-00 cardiovascular disorders: general terms,"Consumption of polyunsaturated fatty acids (PUFA), especially the n3-series, may protect against cardiovascular disease (CVD), but recent randomized studies have failed to demonstrate these benefits.___Increased consumption of omega-3 polyunsaturated fatty acids (PUFA) together with lifestyle measures and medications is recommended for the prevention of cardiovascular diseases.___Omega-6 polyunsaturated fatty acids (n-6 PUFA) are well known for their critical role in many physiological functions and reduce risks of cardiovascular disease (CVD).","acid fatty polyunsaturated;acid, polyunsaturated fatty;acids fatty polyunsaturated;acids, polyunsaturated fatty;fatty acid, polyunsaturated;fatty acid, total polyunsaturated;fatty acids, polyunsaturated;fatty acids.polyunsaturated;polyunsaturated fatty acid;polyunsaturated fatty acid (substance);polyunsaturated fatty acids;pufa;pufa (polyunsaturated fatty acid);pufa - polyunsat fatty acid;pufa - polyunsaturated fatty acid;pufas","3-00 cardiovascular disorders: general terms;[x]cardiovasc disease,unspecif;[x]cardiovascular disease, unspecified;[x]cardiovascular disease, unspecified (disorder);cardiovasc dis;cardiovasc disease,unspecif;cardiovascular disease;cardiovascular disease (cvd);cardiovascular disease, nos;cardiovascular disease, unspecified;cardiovascular diseases;cardiovascular disorder;cardiovascular disorder (nos);cardiovascular disorder nos;cardiovascular disorder, nos;cardiovascular disorders;cardiovascular disorders (diagnosis);cardiovascular disorders, general;cardiovascular disorders: general terms;cardiovascular system disease;cardiovascular system diseases;cardiovascular system--diseases;cardiovascular; disorder;chapter 3 diseases of the cardiovascular system;cv disorders;cvd - cardiovascular disease;cvd, nos;cvs - cardiovascular system diseases;cvs disease;cvs disease - cardiovascular system disease;cvs disorders nos;disease (or disorder); cardiovascular;disease of cardiovascular system;disease of cardiovascular system (disorder);disease of cardiovascular system, nos;disease or syndrome of cardiovascular system;disease, cardiovascular;disease;cardiovascular;diseases affecting the entire cardiovascular system;diseases and syndromes of cardiovascular system;diseases of the cardiovascular system;diseases, cardiovascular;disorder cardiovascular (nos);disorder of cardiovascular system;disorder of cardiovascular system (disorder);general cardiovascular system diseases and syndromes;section 3-0 diseases affecting the entire cardiovascular system",chemdis,treat,3,treat,1,
374,acid fatty polyunsaturated,3-10 heart diseases: general terms,The UK dietary guidelines for cardiovascular disease acknowledge the importance of long-chain omega-3 polyunsaturated fatty acids (PUFA) - a component of fish oils - in reducing heart disease risk.,"acid fatty polyunsaturated;acid, polyunsaturated fatty;acids fatty polyunsaturated;acids, polyunsaturated fatty;fatty acid, polyunsaturated;fatty acid, total polyunsaturated;fatty acids, polyunsaturated;fatty acids.polyunsaturated;polyunsaturated fatty acid;polyunsaturated fatty acid (substance);polyunsaturated fatty acids;pufa;pufa (polyunsaturated fatty acid);pufa - polyunsat fatty acid;pufa - polyunsaturated fatty acid;pufas","3-10 heart diseases: general terms;cardiac dis;cardiac disease;cardiac diseases;cardiac disorder;cardiac disorder nos;cardiac disorders;cardiopathies;cardiopathy;cardiopathy, nos;cordis; morbus;disease cardiac;disease disorders heart;disease hearts;disease or syndrome of heart;disease;heart;diseases and syndromes of heart;diseases disorders heart;diseases of the heart;disorder cardiac (nos);disorder heart;disorder of heart;heart dis;heart disease;heart disease (diagnosis);heart disease (disorder);heart disease disorder;heart disease nos;heart disease nos (disorder);heart disease, nos;heart disease, unspecified;heart diseases;heart diseases: general terms;heart disorder;heart disorders;heart--diseases;morbus cordis;morbus cordis nos;morbus cordis, nos;morbus; cordis;rndx cardiac;rndx cardiac (diagnosis);section 3-1 heart diseases;syndrome heart disease;unspecified heart problem",chemdis,treat,1,treat,1,
375,acid fatty polyunsaturated,arrhythmia,"Also, PUFA and vitamin C might be able to significantly decrease the incidence of arrhythmia; however, reno-protective effects and impact on overall mortality of these supplements seem to be less impressive.","acid fatty polyunsaturated;acid, polyunsaturated fatty;acids fatty polyunsaturated;acids, polyunsaturated fatty;fatty acid, polyunsaturated;fatty acid, total polyunsaturated;fatty acids, polyunsaturated;fatty acids.polyunsaturated;polyunsaturated fatty acid;polyunsaturated fatty acid (substance);polyunsaturated fatty acids;pufa;pufa (polyunsaturated fatty acid);pufa - polyunsat fatty acid;pufa - polyunsaturated fatty acid;pufas",arrhythmia,chemdis,treat,1,treat,1,
376,acid fatty polyunsaturated,arrhythmic,"Marine n-3 PUFA have a number of anti-atherosclerotic effects, including anti-arrhythmic properties and, at relatively high doses, reduce serum triglycerides.","acid fatty polyunsaturated;acid, polyunsaturated fatty;acids fatty polyunsaturated;acids, polyunsaturated fatty;fatty acid, polyunsaturated;fatty acid, total polyunsaturated;fatty acids, polyunsaturated;fatty acids.polyunsaturated;polyunsaturated fatty acid;polyunsaturated fatty acid (substance);polyunsaturated fatty acids;pufa;pufa (polyunsaturated fatty acid);pufa - polyunsat fatty acid;pufa - polyunsaturated fatty acid;pufas",arrhythmic,chemdis,treat,1,treat,1,
377,acid fatty polyunsaturated,arterial stiffness,"The positive influence of PUFAs might be via lowering arterial stiffness, resulting in a better CVD risk profile","acid fatty polyunsaturated;acid, polyunsaturated fatty;acids fatty polyunsaturated;acids, polyunsaturated fatty;fatty acid, polyunsaturated;fatty acid, total polyunsaturated;fatty acids, polyunsaturated;fatty acids.polyunsaturated;polyunsaturated fatty acid;polyunsaturated fatty acid (substance);polyunsaturated fatty acids;pufa;pufa (polyunsaturated fatty acid);pufa - polyunsat fatty acid;pufa - polyunsaturated fatty acid;pufas","arterial stiffness;arterial stiffnesses;stiffness, arterial",chemdis,treat,1,treat,1,
378,acid fatty polyunsaturated,atrial fibrillation,Prophylactic supplementation with omega-3 polyunsaturated fatty acids (PUFAs) reduce vulnerability to atrial fibrillation (AF).,"acid fatty polyunsaturated;acid, polyunsaturated fatty;acids fatty polyunsaturated;acids, polyunsaturated fatty;fatty acid, polyunsaturated;fatty acid, total polyunsaturated;fatty acids, polyunsaturated;fatty acids.polyunsaturated;polyunsaturated fatty acid;polyunsaturated fatty acid (substance);polyunsaturated fatty acids;pufa;pufa (polyunsaturated fatty acid);pufa - polyunsat fatty acid;pufa - polyunsaturated fatty acid;pufas",atrial fibrillation,chemdis,treat,1,treat,1,
379,acid fatty polyunsaturated,cardiac hypertrophies,"The enrichment of myocardial membranes with n-3 PUFA also reduces vulnerability to cardiac arrhythmias, particularly ventricular fibrillation during myocardial ischaemia and reperfusion, and attenuates heart failure and cardiac hypertrophy.","acid fatty polyunsaturated;acid, polyunsaturated fatty;acids fatty polyunsaturated;acids, polyunsaturated fatty;fatty acid, polyunsaturated;fatty acid, total polyunsaturated;fatty acids, polyunsaturated;fatty acids.polyunsaturated;polyunsaturated fatty acid;polyunsaturated fatty acid (substance);polyunsaturated fatty acids;pufa;pufa (polyunsaturated fatty acid);pufa - polyunsat fatty acid;pufa - polyunsaturated fatty acid;pufas","cardiac hypertrophies;cardiac hypertrophy;cardiac hypertrophy nos;cardiac hypertrophy nos (disorder);cardiac; hypertrophy;heart hypertrophies;heart hypertrophy;heart--hypertrophy;heart; hypertrophy;hypertrophic heart;hypertrophic;heart;hypertrophies, cardiac;hypertrophies, heart;hypertrophy, cardiac;hypertrophy, heart;hypertrophy; cardiac;hypertrophy; heart",chemdis,treat,1,treat,1,
380,acid fatty polyunsaturated,cardiac ischaemia,"Polyunsaturated fatty acids (PUFA), in the form of marine oils, contain a large proportion of n-3 long chain fatty acids and have been recommended as a dietary supplement for patients with ischaemic heart disease.","acid fatty polyunsaturated;acid, polyunsaturated fatty;acids fatty polyunsaturated;acids, polyunsaturated fatty;fatty acid, polyunsaturated;fatty acid, total polyunsaturated;fatty acids, polyunsaturated;fatty acids.polyunsaturated;polyunsaturated fatty acid;polyunsaturated fatty acid (substance);polyunsaturated fatty acids;pufa;pufa (polyunsaturated fatty acid);pufa - polyunsat fatty acid;pufa - polyunsaturated fatty acid;pufas",cardiac ischaemia;cardiac ischemia;ischaemic heart disease;myocardial ischaemia;myocardial ischemia,chemdis,treat,1,treat,1,
381,acid fatty polyunsaturated,cognitive decline,Fish intake and the long-chain omega-3 polyunsaturated fatty acids (PUFAs) in fish have been suggested to lower the risk of cognitive decline.,"acid fatty polyunsaturated;acid, polyunsaturated fatty;acids fatty polyunsaturated;acids, polyunsaturated fatty;fatty acid, polyunsaturated;fatty acid, total polyunsaturated;fatty acids, polyunsaturated;fatty acids.polyunsaturated;polyunsaturated fatty acid;polyunsaturated fatty acid (substance);polyunsaturated fatty acids;pufa;pufa (polyunsaturated fatty acid);pufa - polyunsat fatty acid;pufa - polyunsaturated fatty acid;pufas",cognitive decline,chemdis,treat,1,treat,1,
382,acid fatty polyunsaturated,coronary heart disease,"Evidence from appropriately designed and vigorously executed randomized controlled trials support that high-PUFA (predominantly linoleic acid) and low-SFA diets, compared to high-SFA diets, reduced the risk of coronary heart disease.___Multiple trials over the past two decades testing omega-3 polyunsaturated fatty acids (PUFAs), containing eicosapentaenoic acid (EPA) and or docosahexaenoic acid (DHA), have shown substantial benefits for reducing major coronary heart disease (CHD) events, all-cause mortality, cardiovascular (CV) death, sudden cardiac death (SCD), and stroke.___Dietary n-3 polyunsaturated fatty acids (PUFA) reduce coronary heart disease (CHD) complications, such as chronic arrhythmia and sudden cardiac death.___Consumption of polyunsaturated fatty acids (PUFAs) may reduce coronary heart disease (CHD) risk, but n-6 PUFAs may compete with n-3 PUFA metabolism and attenuate benefits.___2006, 296:1885-99) have made a strong case for the beneficial effects of PUFAs in reducing the risk of coronary heart disease, but at the same time, have also broadly discounted the increased risks of coronary heart disease posed by MeHg in fish, stating that ""... among adults... the benefits of fish intake exceed the potential risks.","acid fatty polyunsaturated;acid, polyunsaturated fatty;acids fatty polyunsaturated;acids, polyunsaturated fatty;fatty acid, polyunsaturated;fatty acid, total polyunsaturated;fatty acids, polyunsaturated;fatty acids.polyunsaturated;polyunsaturated fatty acid;polyunsaturated fatty acid (substance);polyunsaturated fatty acids;pufa;pufa (polyunsaturated fatty acid);pufa - polyunsat fatty acid;pufa - polyunsaturated fatty acid;pufas",coronary heart disease,chemdis,treat,5,treat,1,
383,acid fatty polyunsaturated,"damage, reperfusion",We hypothesized that a specific dietary fatty acid profile (low in saturated and n-6 PUFA but high in plant and marine n-3 PUFA) may improve myocardial resistance to ischemia-reperfusion injury and reduce infarct size.,"acid fatty polyunsaturated;acid, polyunsaturated fatty;acids fatty polyunsaturated;acids, polyunsaturated fatty;fatty acid, polyunsaturated;fatty acid, total polyunsaturated;fatty acids, polyunsaturated;fatty acids.polyunsaturated;polyunsaturated fatty acid;polyunsaturated fatty acid (substance);polyunsaturated fatty acids;pufa;pufa (polyunsaturated fatty acid);pufa - polyunsat fatty acid;pufa - polyunsaturated fatty acid;pufas","damage, reperfusion;damages, reperfusion;inj ischemia reperfusion;inj reperfusion;injuries, ischemia-reperfusion;injuries, reperfusion;injury reperfusion;injury, ischemia reperfusion;injury, ischemia-reperfusion;injury, reperfusion;ischaemia-reperfusion injury;ischemia reperfusion inj;ischemia reperfusion injury;ischemia-reperfusion injuries;ischemia-reperfusion injury;ischemia-reperfusion injury (morphologic abnormality);reperfusion damage;reperfusion damages;reperfusion inj;reperfusion injuries;reperfusion injury",chemdis,treat,1,treat,0,
384,acid fatty polyunsaturated,degenerative disease,"The role at omega-3 polyunsaturated fatty acids (PUFA), especially eicosa pentanoic acid (EPA) and decosahexaconic (DHA), has been associated with the prevention of degenerative disease.","acid fatty polyunsaturated;acid, polyunsaturated fatty;acids fatty polyunsaturated;acids, polyunsaturated fatty;fatty acid, polyunsaturated;fatty acid, total polyunsaturated;fatty acids, polyunsaturated;fatty acids.polyunsaturated;polyunsaturated fatty acid;polyunsaturated fatty acid (substance);polyunsaturated fatty acids;pufa;pufa (polyunsaturated fatty acid);pufa - polyunsat fatty acid;pufa - polyunsaturated fatty acid;pufas",degenerative disease;degenerative disorder;degenerative disorder (diagnosis);degenerative disorder (disorder);degenerative disorders,chemdis,treat,1,treat,1,
389,acid fatty polyunsaturated,ischemic heart disease,"There is evidence that replacing saturated fat (SFA) with polyunsaturated fat (PUFA) lowers ischemic heart disease (IHD).___In regards to studies examined in this narrative review, recommendation for n-6 PUFA intake above 5%, and ideally about 10% of total energy appears justified for the prevention of ischemic heart disease.","acid fatty polyunsaturated;acid, polyunsaturated fatty;acids fatty polyunsaturated;acids, polyunsaturated fatty;fatty acid, polyunsaturated;fatty acid, total polyunsaturated;fatty acids, polyunsaturated;fatty acids.polyunsaturated;polyunsaturated fatty acid;polyunsaturated fatty acid (substance);polyunsaturated fatty acids;pufa;pufa (polyunsaturated fatty acid);pufa - polyunsat fatty acid;pufa - polyunsaturated fatty acid;pufas",ischemic heart disease,chemdis,treat,2,treat,1,
390,"acid, monounsaturated fatty",3-00 cardiovascular disorders: general terms,"Caryocar brasiliense (pequi) oil is high in monounsaturated fat acids (MUFA), especially oleic, and in carotenoids, which have been associated with protection against cardiovascular disease.","acid, monounsaturated fatty;acids, monounsaturated fatty;fatty acid, monounsaturated;fatty acid, total monounsaturated;fatty acids, monounsaturated;fatty acids.monounsaturated;monounsaturated fatty acid;monounsaturated fatty acid (substance);monounsaturated fatty acids;mufa;mufa - monounsat fatty acid;mufa - monounsaturated fatty acid","3-00 cardiovascular disorders: general terms;[x]cardiovasc disease,unspecif;[x]cardiovascular disease, unspecified;[x]cardiovascular disease, unspecified (disorder);cardiovasc dis;cardiovasc disease,unspecif;cardiovascular disease;cardiovascular disease (cvd);cardiovascular disease, nos;cardiovascular disease, unspecified;cardiovascular diseases;cardiovascular disorder;cardiovascular disorder (nos);cardiovascular disorder nos;cardiovascular disorder, nos;cardiovascular disorders;cardiovascular disorders (diagnosis);cardiovascular disorders, general;cardiovascular disorders: general terms;cardiovascular system disease;cardiovascular system diseases;cardiovascular system--diseases;cardiovascular; disorder;chapter 3 diseases of the cardiovascular system;cv disorders;cvd - cardiovascular disease;cvd, nos;cvs - cardiovascular system diseases;cvs disease;cvs disease - cardiovascular system disease;cvs disorders nos;disease (or disorder); cardiovascular;disease of cardiovascular system;disease of cardiovascular system (disorder);disease of cardiovascular system, nos;disease or syndrome of cardiovascular system;disease, cardiovascular;disease;cardiovascular;diseases affecting the entire cardiovascular system;diseases and syndromes of cardiovascular system;diseases of the cardiovascular system;diseases, cardiovascular;disorder cardiovascular (nos);disorder of cardiovascular system;disorder of cardiovascular system (disorder);general cardiovascular system diseases and syndromes;section 3-0 diseases affecting the entire cardiovascular system",chemdis,treat,1,treat,1,
391,"acid, monounsaturated fatty",coronary heart disease,"Evidence is accumulating that diets low in saturated fatty acids and high in monounsaturated fatty acids are effective in controlling blood lipid levels; a likely consequence could be a beneficial effect on the risk of coronary heart disease.___It is concluded that the significantly longer lag phase for oxidation of LDL, the higher HDL cholesterol level and the lower triacylglycerol level in subjects following a carotenoid-controlled, MUFA-enriched diet may decrease the risk of coronary heart disease.","acid, monounsaturated fatty;acids, monounsaturated fatty;fatty acid, monounsaturated;fatty acid, total monounsaturated;fatty acids, monounsaturated;fatty acids.monounsaturated;monounsaturated fatty acid;monounsaturated fatty acid (substance);monounsaturated fatty acids;mufa;mufa - monounsat fatty acid;mufa - monounsaturated fatty acid",coronary heart disease,chemdis,treat,2,treat,0,
392,"acid, monounsaturated fatty",inflamm,"There are persuasive evidences that dietary substitution of monounsaturated fatty acids (MUFA) or n-6 polyunsaturated fatty acids (PUFA) for SFA lowers blood cholesterol and may have beneficial effects on inflammation, thrombosis, and vascular reactivity.","acid, monounsaturated fatty;acids, monounsaturated fatty;fatty acid, monounsaturated;fatty acid, total monounsaturated;fatty acids, monounsaturated;fatty acids.monounsaturated;monounsaturated fatty acid;monounsaturated fatty acid (substance);monounsaturated fatty acids;mufa;mufa - monounsat fatty acid;mufa - monounsaturated fatty acid","inflamm;inflammation;inflammation (morphologic abnormality);inflammation (qualifier value);inflammation nos;inflammation, nos;inflammations;inflammatory reaction;inflammatory reaction, nos",chemdis,treat,1,treat,0,
393,"acid, monounsaturated fatty",thrombosis,"There are persuasive evidences that dietary substitution of monounsaturated fatty acids (MUFA) or n-6 polyunsaturated fatty acids (PUFA) for SFA lowers blood cholesterol and may have beneficial effects on inflammation, thrombosis, and vascular reactivity.","acid, monounsaturated fatty;acids, monounsaturated fatty;fatty acid, monounsaturated;fatty acid, total monounsaturated;fatty acids, monounsaturated;fatty acids.monounsaturated;monounsaturated fatty acid;monounsaturated fatty acid (substance);monounsaturated fatty acids;mufa;mufa - monounsat fatty acid;mufa - monounsaturated fatty acid",thrombosis,chemdis,treat,1,treat,0,
394,"acid, n-3 fatty",(neoplasms) or (cancers),"Epidemiological studies and animal experiments indicate that n-3 fatty acids exert protective effects against some common cancers, especially cancers of the breast, colon and prostate.","acid, n-3 fatty;acid, omega-3 fatty;dietary supplements fatty acids (unsaturated) omega-3;fatty acid omega 3;fatty acid, n-3;fatty acid, n3;fatty acid, omega-3;fatty acids n 03;fatty acids omega 03;fatty acids, omega-3;fatty acids.omega 3;n 3 fatty acid;n 3 fatty acids;n 3 oil;n 3 oils;n 3 polyunsaturated fatty acid;n 3 pufa;n-3 fatty acid;n-3 fatty acid (substance);n-3 fatty acids;n-3 oil;n-3 oils;n-3 polyunsaturated fatty acid;n-3 pufa;n3 fatty acid;n3 oil;n3 oils;n3 polyunsaturated fatty acid;n3 pufa;oil, n-3;oil, n3;omega 3;omega 3 fatty acid;omega 3 fatty acids;omega fatty acids 03;omega-3;omega-3 acid;omega-3 acid triglycerides;omega-3 fatty acids;omega-3 fatty acids (medication);omega-3 phospholipids;omega-3 polyunsaturated fatty acid;omega-3 polyunsaturated fatty acids;omega-3 pufa;omega-3-fatty acids;pufa, n-3;pufa, n3;ω-3 fatty acids","(neoplasms) or (cancers);(neoplasms) or (cancers) (disorder);[x]mal neo w'out specfctn/site;[x]malignant neoplasm without specification of site;[x]malignant neoplasm without specification of site (disorder);^cancer;ca;ca - cancer;ca - unspecified site;ca - unspecified site nos;ca - unspecified site nos (disorder);cancer (diagnosis);cancer (nos);cancer nos;cancer, nos;cancer, unspecified site;cancers;mal neo w'out specfctn/site;malig neop of unspec site;malig neop of unspec site nos;malignancies;malignancy nos;malignancy, unspecified site;malignant growth;malignant neoplasm (diagnosis);malignant neoplasm of unspecified site;malignant neoplasm of unspecified site (disorder);malignant neoplasm of unspecified site nos;malignant neoplasm of unspecified site nos (disorder);malignant neoplasm without specification of site;malignant neoplastic disease;malignant neoplastic disease (disorder);malignant tumor;malignant tumor (disorder);malignant tumoral disease;malignant tumors;malignant tumour;malignant tumour (disorder);malignant tumours;neoplasm malignant;neoplasm/cancer;neoplasms - malignant;neoplasms, malignant;neoplastic disease, malignant;tumor; malignant, unclassified;tumor; unclassified, malignant",chemdis,treat,1,treat,1,
